{
  "$schema": "https://json-schema.org/draft/2020-12/schema",
  "type": "array",
  "items": {
    "type": "object",
    "properties": {
      "id": {
        "type": "string",
        "pattern": "^[a-z0-9][a-z0-9-]*$"
      },
      "kind": {
        "type": "string",
        "enum": [
          "paper",
          "preprint",
          "official",
          "regulator",
          "standard",
          "docs",
          "book",
          "news",
          "dataset"
        ]
      },
      "title": {
        "type": "string"
      },
      "authors": {
        "type": "string"
      },
      "publisher": {
        "type": "string"
      },
      "year": {
        "type": "integer",
        "minimum": -9007199254740991,
        "maximum": 9007199254740991
      },
      "url": {
        "type": "string",
        "format": "uri"
      },
      "doi": {
        "type": "string"
      },
      "arxiv": {
        "type": "string"
      },
      "accessed": {
        "type": "string",
        "pattern": "^\\d{4}-\\d{2}-\\d{2}$"
      },
      "note": {
        "type": "string"
      }
    },
    "required": [
      "id",
      "kind",
      "title",
      "year",
      "url",
      "accessed"
    ]
  }
}
